{
  "schema_version": 1,
  "record_id": "linux-forwarding-20261024T073901Z-981dc0dc",
  "target_id": "linux-7c656fcca275ea36",
  "scenario_id": "linux-static-ipv4-v1",
  "status": "fail",
  "evidence_status": "locally_verified",
  "started_at": "2026-10-24T07:39:03.091801Z",
  "finished_at": "2026-10-24T07:39:18.930303Z",
  "repetitions": 3,
  "target": {
    "path": "corpus/devices/linux/ubuntu-26.04-wsl2-x86_64/6.18.33.2-microsoft-standard-wsl2-7c656fcc/target.json",
    "sha256": "05fa6a8ff5a4814cb3379bf47f9f55dcadef5100e2a0824bb94d567a81e460db"
  },
  "scenario": {
    "path": "corpus/scenarios/linux-static-ipv4-v1.json",
    "sha256": "0a4d95e80382c81090104bb6963aa1a55e4e4df5cf616efd16dd9793325e9c2f"
  },
  "runner_sources": [
    {
      "path": "runner-sources/linux_lab.py",
      "sha256": "e7ff985c60580ae2656bdd48306cfdece1f6b29d48231e90d58108f94a39c814"
    },
    {
      "path": "runner-sources/compare.py",
      "sha256": "81854af1b0a7c675210184edf1e939c28cb8679b83197d28cce90dfb753732bf"
    },
    {
      "path": "runner-sources/validate.py",
      "sha256": "c15dec8d00769fa54d87e1847590cd9b25e0c1822700bd9bddd16d87b4ccc85d"
    },
    {
      "path": "runner-sources/run-linux-lab.ps1",
      "sha256": "af4e95d8e1e16913715f5d33c2431281e000a2637abe897fc1d0a1967573bc8c"
    }
  ],
  "environment": {
    "wsl_distribution_name": "Ubuntu-26.04",
    "network": "isolated namespaces and veth only"
  },
  "comparison": "comparison.json",
  "artifacts": [
    {
      "path": "S01-r1/cleanup.json",
      "sha256": "457aa31e824ff1131f298206ffe834b39fde512605a7adf25578239db175e1cb",
      "bytes": 50
    },
    {
      "path": "S01-r1/commands.json",
      "sha256": "6abf896845aeae4627af19f610cb4c9c02f1bb7ae48816a4d5746d1449c8e084",
      "bytes": 36388
    },
    {
      "path": "S01-r1/observed.json",
      "sha256": "812a6923ab768c3a50183bc8579b6b0ef62f7ffc469cfa3428991bb4197f5adf",
      "bytes": 31810
    },
    {
      "path": "S01-r1/router.jsonl",
      "sha256": "2f15223f9cd620ce3a4089bbc8ff981db387d618d161522407392b0096c5d21b",
      "bytes": 1808
    },
    {
      "path": "S01-r1/router.pcap",
      "sha256": "b0166a6cbbc14178dd55facf925201cde10e08c00f70e5d8d8e94dbc8b4c6924",
      "bytes": 488
    },
    {
      "path": "S01-r1/router.stats.json",
      "sha256": "b9fec23d8b99d8177cc282740e8f4379dd9626d27d288bb4990daba014a245d5",
      "bytes": 68
    },
    {
      "path": "S01-r1/router.stderr.log",
      "sha256": "e3b0c44298fc1c149afbf4c8996fb92427ae41e4649b934ca495991b7852b855",
      "bytes": 0
    },
    {
      "path": "S01-r1/source.jsonl",
      "sha256": "f0213f166279b8afd9c694d27db74454d31d9233e157528295247eff220c647a",
      "bytes": 1130
    },
    {
      "path": "S01-r1/source.pcap",
      "sha256": "07c8880bb4da2f28d9144db6980ad71ce2671a731161501bbe9c27fd34e22144",
      "bytes": 314
    },
    {
      "path": "S01-r1/source.stats.json",
      "sha256": "deeea9bf0787b8f4913963ef249a85cb0fe9b8867adb56f42fccb8cbadfeaeb5",
      "bytes": 68
    },
    {
      "path": "S01-r1/source.stderr.log",
      "sha256": "e3b0c44298fc1c149afbf4c8996fb92427ae41e4649b934ca495991b7852b855",
      "bytes": 0
    },
    {
      "path": "S01-r2/cleanup.json",
      "sha256": "457aa31e824ff1131f298206ffe834b39fde512605a7adf25578239db175e1cb",
      "bytes": 50
    },
    {
      "path": "S01-r2/commands.json",
      "sha256": "78280cacc2dbdb3d593289f238027e7a778cbf85893aec56e95a84993c1d8fce",
      "bytes": 36388
    },
    {
      "path": "S01-r2/observed.json",
      "sha256": "96aa1401df173dd8cdee561ed4a30fba2a794ec87ff0ac6190ea580131d516b3",
      "bytes": 31810
    },
    {
      "path": "S01-r2/router.jsonl",
      "sha256": "5e65a209971bced17eba4fe278b72ff996f3325f83ac9a3e73192ea58e126bfc",
      "bytes": 2058
    },
    {
      "path": "S01-r2/router.pcap",
      "sha256": "bcaf3c71f60da27566bb2acdaecf54d07c6e7a72601961fd0eb39538ec214862",
      "bytes": 558
    },
    {
      "path": "S01-r2/router.stats.json",
      "sha256": "5abd7241747cba49ab31c1e3ad80986cf5a9c5bedb286031813b31b08b53384d",
      "bytes": 68
    },
    {
      "path": "S01-r2/router.stderr.log",
      "sha256": "e3b0c44298fc1c149afbf4c8996fb92427ae41e4649b934ca495991b7852b855",
      "bytes": 0
    },
    {
      "path": "S01-r2/source.jsonl",
      "sha256": "9d5ab8333478c2022a13d7b1eef11bee1e62906338b0004be85171f9968be4ef",
      "bytes": 1130
    },
    {
      "path": "S01-r2/source.pcap",
      "sha256": "150bf614ed03a8c9aff45e99c7fcb23c1618b848663a530a4a36d21461553ccf",
      "bytes": 314
    },
    {
      "path": "S01-r2/source.stats.json",
      "sha256": "deeea9bf0787b8f4913963ef249a85cb0fe9b8867adb56f42fccb8cbadfeaeb5",
      "bytes": 68
    },
    {
      "path": "S01-r2/source.stderr.log",
      "sha256": "e3b0c44298fc1c149afbf4c8996fb92427ae41e4649b934ca495991b7852b855",
      "bytes": 0
    },
    {
      "path": "S01-r3/cleanup.json",
      "sha256": "457aa31e824ff1131f298206ffe834b39fde512605a7adf25578239db175e1cb",
      "bytes": 50
    },
    {
      "path": "S01-r3/commands.json",
      "sha256": "c6b14386db421d529b86e88bdf17dc6601f691e68420bd06ac74c0ee9601b2cb",
      "bytes": 36388
    },
    {
      "path": "S01-r3/observed.json",
      "sha256": "96aa1401df173dd8cdee561ed4a30fba2a794ec87ff0ac6190ea580131d516b3",
      "bytes": 31810
    },
    {
      "path": "S01-r3/router.jsonl",
      "sha256": "20610319841b784e78251fabec590cd196f047854c2a8641363a7e51c325e68c",
      "bytes": 2058
    },
    {
      "path": "S01-r3/router.pcap",
      "sha256": "0ce92044f10e085579668fa5778fa568f79bd949e40dea65002a82de002bf115",
      "bytes": 558
    },
    {
      "path": "S01-r3/router.stats.json",
      "sha256": "5abd7241747cba49ab31c1e3ad80986cf5a9c5bedb286031813b31b08b53384d",
      "bytes": 68
    },
    {
      "path": "S01-r3/router.stderr.log",
      "sha256": "e3b0c44298fc1c149afbf4c8996fb92427ae41e4649b934ca495991b7852b855",
      "bytes": 0
    },
    {
      "path": "S01-r3/source.jsonl",
      "sha256": "8b5d0a07341074bdc733b194f7a89630ddcededd3acf291217d47193847cc4fc",
      "bytes": 1130
    },
    {
      "path": "S01-r3/source.pcap",
      "sha256": "0f271696135256504767c981653f7eda12bde96f2c32953291cf0b901ec37f59",
      "bytes": 314
    },
    {
      "path": "S01-r3/source.stats.json",
      "sha256": "deeea9bf0787b8f4913963ef249a85cb0fe9b8867adb56f42fccb8cbadfeaeb5",
      "bytes": 68
    },
    {
      "path": "S01-r3/source.stderr.log",
      "sha256": "e3b0c44298fc1c149afbf4c8996fb92427ae41e4649b934ca495991b7852b855",
      "bytes": 0
    },
    {
      "path": "S01.json",
      "sha256": "5b0f1678af58ec5a4640b9e8d04c004050685c015613b59a1c322d831d1725ee",
      "bytes": 76372
    },
    {
      "path": "S02-r1/cleanup.json",
      "sha256": "457aa31e824ff1131f298206ffe834b39fde512605a7adf25578239db175e1cb",
      "bytes": 50
    },
    {
      "path": "S02-r1/commands.json",
      "sha256": "b37c6a332512285b3a70375a9f7bda4abc15bedbd17560b14c85da3a906dd248",
      "bytes": 35810
    },
    {
      "path": "S02-r1/observed.json",
      "sha256": "9f21dd38fc593509577b39b5c6fa497d8b113b9d343120f6d1804a8a1f152adb",
      "bytes": 31194
    },
    {
      "path": "S02-r1/router.jsonl",
      "sha256": "5b819c8f0fb71862e7376448aa79fb5f1ccbbd3d787fe75fdf44e0b60389b2d2",
      "bytes": 960
    },
    {
      "path": "S02-r1/router.pcap",
      "sha256": "885447301be5e69e82480f171435d72c6cd4563cd688e18a0aa3fcdf2266cc74",
      "bytes": 284
    },
    {
      "path": "S02-r1/router.stats.json",
      "sha256": "b78fa36bccdced6a7d3c677a8b608ce0a10d0ccc0f5ceb321c5598e5d852228d",
      "bytes": 68
    },
    {
      "path": "S02-r1/router.stderr.log",
      "sha256": "e3b0c44298fc1c149afbf4c8996fb92427ae41e4649b934ca495991b7852b855",
      "bytes": 0
    },
    {
      "path": "S02-r1/source.jsonl",
      "sha256": "f930c0327be52d83b8a5f3d530aa284e712f7d22258c2e4eb87689b8032cfc9b",
      "bytes": 1186
    },
    {
      "path": "S02-r1/source.pcap",
      "sha256": "053b575944d311721820ce89ba9f925f402a1841569122f03a7ab89c9b9edbb1",
      "bytes": 342
    },
    {
      "path": "S02-r1/source.stats.json",
      "sha256": "deeea9bf0787b8f4913963ef249a85cb0fe9b8867adb56f42fccb8cbadfeaeb5",
      "bytes": 68
    },
    {
      "path": "S02-r1/source.stderr.log",
      "sha256": "e3b0c44298fc1c149afbf4c8996fb92427ae41e4649b934ca495991b7852b855",
      "bytes": 0
    },
    {
      "path": "S02-r2/cleanup.json",
      "sha256": "457aa31e824ff1131f298206ffe834b39fde512605a7adf25578239db175e1cb",
      "bytes": 50
    },
    {
      "path": "S02-r2/commands.json",
      "sha256": "44abd5194d0aceed088daf3296e0938e7160b77cb8e5493a1966b78d73d2af7f",
      "bytes": 35810
    },
    {
      "path": "S02-r2/observed.json",
      "sha256": "9f21dd38fc593509577b39b5c6fa497d8b113b9d343120f6d1804a8a1f152adb",
      "bytes": 31194
    },
    {
      "path": "S02-r2/router.jsonl",
      "sha256": "a62dffc6a9b7625f432c8f00e7acc481fd81545b8f62b16a0febc66bbf46af18",
      "bytes": 960
    },
    {
      "path": "S02-r2/router.pcap",
      "sha256": "b3b8b378e55413f9a3c7585341281ff208bc20e116ab28de06202c2c94bff0fa",
      "bytes": 284
    },
    {
      "path": "S02-r2/router.stats.json",
      "sha256": "b78fa36bccdced6a7d3c677a8b608ce0a10d0ccc0f5ceb321c5598e5d852228d",
      "bytes": 68
    },
    {
      "path": "S02-r2/router.stderr.log",
      "sha256": "e3b0c44298fc1c149afbf4c8996fb92427ae41e4649b934ca495991b7852b855",
      "bytes": 0
    },
    {
      "path": "S02-r2/source.jsonl",
      "sha256": "d8f01956ddc13a3a0331766444fe5468a6584c253551397b05c692a83f3c9ff3",
      "bytes": 1186
    },
    {
      "path": "S02-r2/source.pcap",
      "sha256": "d28d6f0cca7c9efb36aa7b57461a9d05b3aa484fb0e0a94763dbf06f180d8d62",
      "bytes": 342
    },
    {
      "path": "S02-r2/source.stats.json",
      "sha256": "deeea9bf0787b8f4913963ef249a85cb0fe9b8867adb56f42fccb8cbadfeaeb5",
      "bytes": 68
    },
    {